{
  "$schema": "https://json-schema.org/draft/2020-12/schema",
  "type": "object",
  "properties": {
    "title": {
      "default": "Sin Título",
      "type": "string"
    },
    "atmosfera": {
      "default": "obsidiana"
    },
    "coverImage": {
      "default": null,
      "anyOf": [
        {
          "type": "string"
        },
        {
          "type": "null"
        }
      ]
    },
    "gallery": {
      "default": [],
      "type": "array",
      "items": {
        "type": "string"
      }
    },
    "generadorTexto": {
      "default": null,
      "anyOf": [
        {
          "type": "string"
        },
        {
          "type": "null"
        }
      ]
    },
    "$schema": {
      "type": "string"
    }
  }
}